Series_Title,Released_Year,Genre,Runtime,IMDB_Rating,Overview,Available_On,Subscription_Required,Release_Date,Price
The General,1926,,67 min,8.1,"When Union spies steal an engineer's beloved locomotive, he pursues it single-handedly and straight through enemy lines.",Amazon Prime,False,2017-03-17,0.0
Gisaengchung,2019,"Comedy, Drama, Thriller",132 min,8.6,Greed and class discrimination threaten the newly formed symbiotic relationship between the wealthy Park family and the destitute Kim clan.,HBO Max,,2016-03-24,0.0
Donnie Brasco,1997,"Biography, Crime, Drama",127 min,7.7,"An FBI undercover agent infiltrates the mob and finds himself identifying more with the mafia life, at the expense of his regular one.",,True,2020-12-17,0.0
Black Hawk Down,2001,"Drama, History, War",144 min,,160 elite U.S. soldiers drop into Somalia to capture two top lieutenants of a renegade warlord and find themselves in a desperate battle with a large force of heavily-armed Somalis.,Disney+,True,2015-07-24,14.44
Le dîner de cons,1998,Comedy,80 min,7.7,"A few friends have a weekly fools' dinner, where each brings a fool along. Pierre finds a champion fool for next dinner. Surprise.",Hulu,False,2023-09-27,
Der Himmel über Berlin,1987,"Drama, Fantasy, Romance",128 min,8.0,An angel tires of overseeing human activity and wishes to become human when he falls in love with a mortal.,Disney+,,2016-11-10,0.0
La montaña sagrada,1973,"Adventure, Drama, Fantasy",114 min,7.9,"In a corrupt, greed-fueled world, a powerful alchemist leads a messianic character and seven materialistic figures to the Holy Mountain, where they hope to achieve enlightenment.",Disney+,True,,0.0
Atonement,2007,"Drama, Mystery, Romance",123 min,,Thirteen-year-old fledgling writer Briony Tallis irrevocably changes the course of several lives when she accuses her older sister's lover of a crime he did not commit.,,True,2018-01-04,0.0
The Pianist,2002,"Biography, Drama, Music",150 min,8.5,A Polish Jewish musician struggles to survive the destruction of the Warsaw ghetto of World War II.,Netflix,True,,0.0
Höstsonaten,1978,"Drama, Music",,8.2,"A married daughter who longs for her mother's love is visited by the latter, a successful concert pianist.",Amazon Prime,False,2016-08-29,14.71
"Monsters, Inc.",2001,"Animation, Adventure, Comedy",92 min,8.1,"In order to power the city, monsters have to scare children so that they scream. However, the children are toxic to the monsters, and after a child gets through, 2 monsters realize things may not be what they think.",Amazon Prime,False,,0.0
Who Framed Roger Rabbit,1988,"Animation, Adventure, Comedy",104 min,7.7,A toon-hating detective is a cartoon rabbit's only hope to prove his innocence when he is accused of murder.,HBO Max,True,2022-04-20,0.0
Night on Earth,1991,"Comedy, Drama",129 min,7.8,An anthology of 5 different cab drivers in 5 American and European cities and their remarkable fares on the same eventful night.,Amazon Prime,True,2019-08-03,12.61
(500) Days of Summer,2009,"Comedy, Drama, Romance",95 min,7.7,"An offbeat romantic comedy about a woman who doesn't believe true love exists, and the young man who falls for her.",Netflix,False,2023-03-10,0.0
A Man for All Seasons,1966,"Biography, Drama, History",120 min,7.7,,,True,2019-05-27,0.0
Black,2005,Drama,122 min,,"The cathartic tale of a young woman who can't see, hear or talk and the teacher who brings a ray of light into her dark world.",,,2015-07-24,0.0
Le samouraï,1967,"Crime, Drama, Mystery",105 min,8.1,After professional hitman Jef Costello is seen by witnesses his efforts to provide himself an alibi drive him further into a corner.,,True,2017-12-04,0.0
Ang-ma-reul bo-at-da,2010,"Action, Crime, Drama",144 min,7.8,A secret agent exacts revenge on a serial killer through a series of captures and releases.,Hulu,True,2016-12-11,0.0
The Gentlemen,2019,"Action, Comedy, Crime",113 min,,"An American expat tries to sell off his highly profitable marijuana empire in London, triggering plots, schemes, bribery and blackmail in an attempt to steal his domain out from under him.",Amazon Prime,,2016-04-06,0.0
Midnight in Paris,2011,"Comedy, Fantasy, Romance",96 min,7.7,"While on a trip to Paris with his fiancée's family, a nostalgic screenwriter finds himself mysteriously going back to the 1920s every day at midnight.",,False,2020-04-05,0.0
One Flew Over the Cuckoo's Nest,1975,Drama,133 min,8.7,"A criminal pleads insanity and is admitted to a mental institution, where he rebels against the oppressive nurse and rallies up the scared patients.",Netflix,,,
The Kid,1921,"Comedy, Drama, Family",68 min,8.3,"The Tramp cares for an abandoned child, but events put that relationship in jeopardy.",,True,,16.82
Badhaai ho,2018,,,8.0,A man is embarrassed when he finds out his mother is pregnant.,Disney+,,2018-01-20,0.0
Fargo,1996,"Crime, Drama, Thriller",98 min,,,Netflix,,2020-11-14,12.88
Ed Wood,1994,"Biography, Comedy, Drama",127 min,7.8,"Ambitious but troubled movie director Edward D. Wood Jr. tries his best to fulfill his dreams, despite his lack of talent.",,False,,7.95
Dead Man,1995,"Adventure, Drama, Fantasy",,7.6,"On the run after murdering a man, accountant William Blake encounters a strange aboriginal American man named Nobody who prepares him for his journey into the spiritual world.",,False,2019-12-10,0.0
All About Eve,1950,Drama,,,A seemingly timid but secretly ruthless ingénue insinuates herself into the lives of an aging Broadway star and her circle of theater friends.,HBO Max,False,,10.37
Per qualche dollaro in più,1965,Western,132 min,8.3,Two bounty hunters with the same intentions team up to track down a Western outlaw.,Hulu,False,2017-05-29,0.0
The Boy in the Striped Pyjamas,2008,"Drama, History, War",94 min,7.8,"Through the innocent eyes of Bruno, the eight-year-old son of the commandant at a German concentration camp, a forbidden friendship with a Jewish boy on the other side of the camp fence has startling and unexpected consequences.",HBO Max,False,2015-05-06,0.0
Straight Outta Compton,2015,"Biography, Drama, History",147 min,7.8,"The rap group NWA emerges from the mean streets of Compton in Los Angeles, California, in the mid-1980s and revolutionizes Hip Hop culture with their music and tales about life in the hood.",Netflix,True,2019-11-09,5.05
To Kill a Mockingbird,1962,"Crime, Drama",129 min,8.2,"Atticus Finch, a lawyer in the Depression-era South, defends a black man against an undeserved rape charge, and his children against prejudice.",Disney+,True,2019-01-26,0.0
Kakushi-toride no san-akunin,1958,"Adventure, Drama",139 min,8.1,"Lured by gold, two greedy peasants unknowingly escort a princess and her general across enemy lines.",,,2022-02-02,
Changeling,2008,,141 min,7.7,Grief-stricken mother Christine Collins (Angelina Jolie) takes on the L.A.P.D. to her own detriment when it tries to pass off an obvious impostor as her missing child.,,False,2015-09-01,
Shadow of a Doubt,1943,"Film-Noir, Thriller",108 min,7.8,"A young girl, overjoyed when her favorite uncle comes to visit the family, slowly begins to suspect that he is in fact the ""Merry Widow"" killer sought by the authorities.",,True,2022-07-30,0.0
Wind River,2017,,107 min,7.7,A veteran hunter helps an FBI agent investigate the murder of a young woman on a Wyoming Native American reservation.,Netflix,False,2024-10-12,0.0
Ghostbusters,1984,"Action, Comedy, Fantasy",105 min,7.8,Three former parapsychology professors set up shop as a unique ghost removal service.,Disney+,False,2019-08-11,14.55
Lethal Weapon,1987,,109 min,7.6,Two newly paired cops who are complete opposites must put aside their differences in order to catch a gang of drug smugglers.,,True,2017-10-19,0.0
Boogie Nights,1997,Drama,155 min,7.9,"Back when sex was safe, pleasure was a business and business was booming, an idealistic porn producer aspires to elevate his craft to an art when he discovers a hot young talent.",Amazon Prime,,2019-08-10,0.0
The Muppet Movie,1979,"Adventure, Comedy, Family",95 min,7.6,"Kermit and his newfound friends trek across America to find success in Hollywood, but a frog legs merchant is after Kermit.",Amazon Prime,False,2024-02-18,6.88
Nuovo Cinema Paradiso,1988,"Drama, Romance",155 min,,A filmmaker recalls his childhood when falling in love with the pictures at the cinema of his home village and forms a deep friendship with the cinema's projectionist.,Netflix,True,2015-10-10,0.0
Celda 211,2009,"Action, Adventure, Crime",113 min,7.6,"The story of two men on different sides of a prison riot -- the inmate leading the rebellion and the young guard trapped in the revolt, who poses as a prisoner in a desperate attempt to survive the ordeal.",Hulu,True,2025-01-24,18.59
Der Untergang,2004,"Biography, Drama, History",156 min,8.2,,,False,2021-11-06,0.0
Deliverance,1972,"Adventure, Drama, Thriller",109 min,7.7,"Intent on seeing the Cahulawassee River before it's dammed and turned into a lake, outdoor fanatic Lewis Medlock takes his friends on a canoeing trip they'll never forget into the dangerous American back-country.",,,2021-11-26,0.0
Die Hard,1988,,132 min,8.2,An NYPD officer tries to save his wife and several others taken hostage by German terrorists during a Christmas party at the Nakatomi Plaza in Los Angeles.,Netflix,True,2021-07-25,16.32
Star Wars: Episode V - The Empire Strikes Back,1980,"Action, Adventure, Fantasy",124 min,8.7,"After the Rebels are brutally overpowered by the Empire on the ice planet Hoth, Luke Skywalker begins Jedi training with Yoda, while his friends are pursued by Darth Vader and a bounty hunter named Boba Fett all over the galaxy.",Hulu,False,2022-02-01,0.0
The Bourne Identity,2002,"Action, Mystery, Thriller",119 min,,,,,2018-02-12,0.0
Once Upon a Time in the West,1968,,165 min,8.5,A mysterious stranger with a harmonica joins forces with a notorious desperado to protect a beautiful widow from a ruthless assassin working for the railroad.,Hulu,False,2018-09-06,
Omohide poro poro,1991,"Animation, Drama, Romance",118 min,7.6,A twenty-seven-year-old office worker travels to the countryside while reminiscing about her childhood in Tokyo.,Hulu,False,2021-08-29,0.0
Finding Neverland,2004,"Biography, Drama, Family",106 min,7.6,The story of Sir J.M. Barrie's friendship with a family who inspired him to create Peter Pan.,,False,2018-06-08,
Mulholland Dr.,2001,,147 min,7.9,,Disney+,False,2023-11-10,3.41
The Hurricane,1999,"Biography, Drama, Sport",146 min,,"The story of Rubin 'Hurricane' Carter, a boxer wrongly imprisoned for murder, and the people who aided in his fight to prove his innocence.",Netflix,False,2020-04-06,
Bir Zamanlar Anadolu'da,2011,"Crime, Drama",157 min,,A group of men set out in search of a dead body in the Anatolian steppes.,Amazon Prime,True,,3.96
Chinatown,1974,"Drama, Mystery, Thriller",130 min,8.1,"A private detective hired to expose an adulterer finds himself caught up in a web of deceit, corruption, and murder.",Hulu,True,2023-06-15,0.0
Scarface: The Shame of the Nation,1932,"Action, Crime, Drama",93 min,7.8,"An ambitious and nearly insane violent gangster climbs the ladder of success in the mob, but his weaknesses prove to be his downfall.",Netflix,False,2022-06-09,9.01
Dark Waters,2019,"Biography, Drama, History",126 min,7.6,A corporate defense attorney takes on an environmental lawsuit against a chemical company that exposes a lengthy history of pollution.,,False,2017-02-10,3.71
Gran Torino,2008,Drama,116 min,,"Disgruntled Korean War veteran Walt Kowalski sets out to reform his neighbor, Thao Lor, a Hmong teenager who tried to steal Kowalski's prized possession: a 1972 Gran Torino.",HBO Max,False,2025-01-15,0.0
La vita è bella,1997,"Comedy, Drama, Romance",116 min,8.6,,Hulu,True,2017-03-04,0.0
Lola rennt,1998,,81 min,7.6,,,False,2024-03-06,5.18
Anatomy of a Murder,1959,"Crime, Drama, Mystery",161 min,8.0,,Disney+,True,2021-05-08,8.17
Minority Report,2002,"Action, Crime, Mystery",,7.6,"In a future where a special police unit is able to arrest murderers before they commit their crimes, an officer from that unit is himself accused of a future murder.",,False,2018-05-14,0.0
Sin City,2005,"Crime, Thriller",124 min,8.0,"A movie that explores the dark and miserable town, Basin City, tells the story of three different people, all caught up in violent corruption.",,False,2016-03-28,0.0
Mary and Max,2009,"Animation, Comedy, Drama",92 min,8.1,"A tale of friendship between two unlikely pen pals: Mary, a lonely, eight-year-old girl living in the suburbs of Melbourne, and Max, a forty-four-year old, severely obese man living in New York.",Amazon Prime,True,2022-12-18,3.32
The Departed,2006,"Crime, Drama, Thriller",151 min,8.5,An undercover cop and a mole in the police attempt to identify each other while infiltrating an Irish gang in South Boston.,Disney+,False,,0.0
The Bridges of Madison County,1995,"Drama, Romance",135 min,7.6,Photographer Robert Kincaid wanders into the life of housewife Francesca Johnson for four days in the 1960s.,Amazon Prime,False,2022-02-20,0.0
Kal Ho Naa Ho,2003,"Comedy, Drama, Musical",186 min,8.0,,,True,,0.0
Isle of Dogs,2018,"Animation, Adventure, Comedy",101 min,7.9,"Set in Japan, Isle of Dogs follows a boy's odyssey in search of his lost dog.",Netflix,False,2020-06-24,0.0
Trois couleurs: Blanc,1994,,92 min,7.6,"After his wife divorces him, a Polish immigrant plots to get even with her.",,,2018-08-07,0.0
Enter the Dragon,1973,,102 min,7.7,A secret agent comes to an opium lord's island fortress with other fighters for a martial-arts tournament.,Amazon Prime,True,2019-11-16,0.0
Mary Poppins,1964,"Comedy, Family, Fantasy",139 min,7.8,"In turn of the century London, a magical nanny employs music and adventure to help two neglected children become closer to their father.",HBO Max,True,2019-06-16,0.0
Ordinary People,1980,,124 min,7.7,"The accidental death of the older son of an affluent family deeply strains the relationships among the bitter mother, the good-natured father, and the guilt-ridden younger son.",,,2015-09-12,
Sherlock Jr.,1924,"Action, Comedy, Romance",45 min,8.2,"A film projectionist longs to be a detective, and puts his meagre skills to work when he is framed by a rival for stealing his girlfriend's father's pocketwatch.",Disney+,False,2025-02-02,0.0
Where Eagles Dare,1968,"Action, Adventure, War",158 min,7.7,"Allied agents stage a daring raid on a castle where the Nazis are holding American brigadier general George Carnaby prisoner, but that's not all that's really going on.",HBO Max,True,2019-08-14,
Peeping Tom,1960,"Drama, Horror, Thriller",,,"A young man murders women, using a movie camera to film their dying expressions of terror.",Hulu,True,2018-05-29,0.0
Shaun of the Dead,2004,,,7.9,A man's uneventful life is disrupted by the zombie apocalypse.,Netflix,True,2020-06-19,1.94
Dazed and Confused,1993,Comedy,,7.6,The adventures of high school and junior high students on the last day of school in May 1976.,Disney+,True,2022-02-06,0.0
Withnail & I,1987,"Comedy, Drama",107 min,7.7,"In 1969, two substance-abusing, unemployed actors retreat to the countryside for a holiday that proves disastrous.",Hulu,True,2025-03-15,0.0
M.S. Dhoni: The Untold Story,2016,"Biography, Drama, Sport",184 min,7.8,The untold story of Mahendra Singh Dhoni's journey from ticket collector to trophy collector - the world-cup-winning captain of the Indian Cricket Team.,,False,2015-05-09,
Falling Down,1993,,113 min,7.6,An ordinary man frustrated with the various flaws he sees in society begins to psychotically and violently lash out against them.,,,2020-10-02,15.22
L.A. Confidential,1997,"Crime, Drama, Mystery",138 min,8.2,"As corruption grows in 1950s Los Angeles, three policemen - one strait-laced, one brutal, and one sleazy - investigate a series of murders with their own brand of justice.",Netflix,True,2020-06-13,9.46
Kick-Ass,2010,"Action, Comedy, Crime",117 min,7.6,"Dave Lizewski is an unnoticed high school student and comic book fan who one day decides to become a superhero, even though he has no powers, training or meaningful reason to do so.",HBO Max,True,2022-01-03,0.0
V for Vendetta,2005,,,8.2,"In a future British tyranny, a shadowy freedom fighter, known only by the alias of ""V"", plots to overthrow it with the help of a young woman.",Hulu,True,2023-11-24,
Happiness,1998,"Comedy, Drama",134 min,7.7,"The lives of several individuals intertwine as they go about their lives in their own unique ways, engaging in acts society as a whole might find disturbing in a desperate search for human connection.",Disney+,False,2020-02-10,0.0
Blowup,1966,"Drama, Mystery, Thriller",111 min,7.6,,Disney+,True,2018-12-01,19.98
Harry Potter and the Deathly Hallows: Part 1,2010,"Adventure, Family, Fantasy",146 min,,"As Harry, Ron, and Hermione race against time and evil to destroy the Horcruxes, they uncover the existence of the three most powerful objects in the wizarding world: the Deathly Hallows.",,True,2017-03-09,18.81
Taxi Driver,1976,"Crime, Drama",114 min,8.3,"A mentally unstable veteran works as a nighttime taxi driver in New York City, where the perceived decadence and sleaze fuels his urge for violent action by attempting to liberate a presidential campaign worker and an underage prostitute.",Amazon Prime,False,2018-04-13,0.0
Harry Potter and the Deathly Hallows: Part 2,2011,"Adventure, Drama, Fantasy",130 min,8.1,"Harry, Ron, and Hermione search for Voldemort's remaining Horcruxes in their effort to destroy the Dark Lord as the final battle rages on at Hogwarts.",HBO Max,True,2023-02-24,0.0
E.T. the Extra-Terrestrial,1982,,,7.8,A troubled child summons the courage to help a friendly alien escape Earth and return to his home world.,Amazon Prime,False,2019-04-08,0.0
Reservoir Dogs,1992,"Crime, Drama, Thriller",99 min,,,HBO Max,False,2018-06-27,0.0
The Last Picture Show,1971,,118 min,8.0,"In 1951, a group of high schoolers come of age in a bleak, isolated, atrophied North Texas town that is slowly dying, both culturally and economically.",Disney+,True,2023-11-14,0.0
The Exorcist,1973,,122 min,8.0,,,,2019-03-09,
The Hangover,2009,Comedy,100 min,7.7,"Three buddies wake up from a bachelor party in Las Vegas, with no memory of the previous night and the bachelor missing. They make their way around the city in order to find their friend before his wedding.",HBO Max,True,2021-03-09,0.0
Loving Vincent,2017,"Animation, Biography, Crime",94 min,,"In a story depicted in oil painted animation, a young man comes to the last hometown of painter Vincent van Gogh (Robert Gulaczyk) to deliver the troubled artist's final letter and ends up investigating his final days there.",HBO Max,,,0.0
Lost in Translation,2003,"Comedy, Drama",,7.7,A faded movie star and a neglected young woman form an unlikely bond after crossing paths in Tokyo.,,False,2023-05-26,
Majo no takkyûbin,1989,"Animation, Adventure, Drama",103 min,7.8,"A young witch, on her mandatory year of independent life, finds fitting into a new community difficult while she supports herself by running an air courier service.",,,2020-10-08,
Vertigo,1958,"Mystery, Romance, Thriller",128 min,,A former police detective juggles wrestling with his personal demons and becoming obsessed with a hauntingly beautiful woman.,Hulu,False,,0.0
Capharnaüm,2018,Drama,126 min,8.4,"While serving a five-year sentence for a violent crime, a 12-year-old boy sues his parents for neglect.",Netflix,True,2018-07-21,
Toy Story 3,2010,"Animation, Adventure, Comedy",,8.2,"The toys are mistakenly delivered to a day-care center instead of the attic right before Andy leaves for college, and it's up to Woody to convince the other toys that they weren't abandoned and to return home.",,False,,0.0
Do the Right Thing,1989,"Comedy, Drama",120 min,8.0,"On the hottest day of the year on a street in the Bedford-Stuyvesant section of Brooklyn, everyone's hate and bigotry smolders and builds until it explodes into violence.",,False,2019-02-06,
The Royal Tenenbaums,2001,,110 min,7.6,The eccentric members of a dysfunctional family reluctantly gather under the same roof for various reasons.,,False,,0.0
PK,2014,"Comedy, Drama, Musical",153 min,8.1,An alien on Earth loses the only device he can use to communicate with his spaceship. His innocent nature and child-like questions force the country to evaluate the impact of religion on its people.,,,2018-04-08,0.0
What's Eating Gilbert Grape,1993,Drama,118 min,7.8,A young man in a small Midwestern town struggles to care for his mentally-disabled younger brother and morbidly obese mother while attempting to pursue his own happiness.,,True,2020-05-25,
Rupan sansei: Kariosutoro no shiro,1979,,100 min,7.7,"A dashing thief, his gang of desperadoes and an intrepid policeman struggle to free a princess from an evil count's clutches, and learn the hidden secret to a fabulous treasure that she holds part of a key to.",,True,,0.0
Death Note: Desu nôto,2006,"Crime, Drama, Fantasy",,7.7,"A battle between the world's two greatest minds begins when Light Yagami finds the Death Note, a notebook with the power to kill, and decides to rid the world of criminals.",HBO Max,True,2016-12-10,0.0
Inception,2010,"Action, Adventure, Sci-Fi",148 min,8.8,A thief who steals corporate secrets through the use of dream-sharing technology is given the inverse task of planting an idea into the mind of a C.E.O.,Hulu,False,2016-09-02,19.14
The Fifth Element,1997,"Action, Adventure, Sci-Fi",126 min,,,Disney+,True,2022-03-25,0.33
The Prestige,2006,"Drama, Mystery, Sci-Fi",130 min,8.5,"After a tragic accident, two stage magicians engage in a battle to create the ultimate illusion while sacrificing everything they have to outwit each other.",HBO Max,True,2021-09-11,0.0
Brief Encounter,1945,,86 min,,"Meeting a stranger in a railway station, a woman is tempted to cheat on her husband.",,False,2021-02-15,0.0
Shrek,2001,"Animation, Adventure, Comedy",90 min,7.8,,,True,,6.51
Fa yeung nin wah,2000,"Drama, Romance",98 min,,"Two neighbors, a woman and a man, form a strong bond after both suspect extramarital activities of their spouses. However, they agree to keep their bond platonic so as not to commit similar wrongs.",HBO Max,True,2021-03-15,0.0
Kumonosu-jô,1957,"Drama, History",110 min,8.1,"A war-hardened general, egged on by his ambitious wife, works to fulfill a prophecy that he would become lord of Spider's Web Castle.",,,2021-11-01,0.0
Star Trek Into Darkness,2013,"Action, Adventure, Sci-Fi",132 min,,"After the crew of the Enterprise find an unstoppable force of terror from within their own organization, Captain Kirk leads a manhunt to a war-zone world to capture a one-man weapon of mass destruction.",Netflix,,2020-02-12,0.0
Sound of Metal,2019,"Drama, Music",120 min,7.8,,Hulu,True,,0.0
Avatar,2009,"Action, Adventure, Fantasy",162 min,,A paraplegic Marine dispatched to the moon Pandora on a unique mission becomes torn between following his orders and protecting the world he feels is his home.,Amazon Prime,,,0.0
Me and Earl and the Dying Girl,2015,"Comedy, Drama",105 min,7.7,"High schooler Greg, who spends most of his time making parodies of classic movies with his co-worker Earl, finds his outlook forever altered after befriending a classmate who has just been diagnosed with cancer.",,False,2018-06-18,0.0
Incredibles 2,2018,"Animation, Action, Adventure",118 min,7.6,The Incredibles family takes on a new mission which involves a change in family roles: Bob Parr (Mr. Incredible) must manage the house while his wife Helen (Elastigirl) goes out to save the world.,Disney+,True,2015-10-02,18.61
Jurassic Park,1993,"Action, Adventure, Sci-Fi",,8.1,A pragmatic paleontologist visiting an almost complete theme park is tasked with protecting a couple of kids after a power failure causes the park's cloned dinosaurs to run loose.,Netflix,True,2017-03-13,17.13
Das weiße Band - Eine deutsche Kindergeschichte,2009,"Drama, History, Mystery",144 min,7.8,"Strange events happen in a small village in the north of Germany during the years before World War I, which seem to be ritual punishment. Who is responsible?",,True,2021-03-04,14.68
Jungfrukällan,1960,Drama,89 min,8.1,"An innocent yet pampered young virgin and her family's pregnant and jealous servant set out to deliver candles to church, but only one returns from events that transpire in the woods along the way.",HBO Max,False,,0.0
Annie Hall,1977,"Comedy, Romance",93 min,8.0,Neurotic New York comedian Alvy Singer falls in love with the ditzy Annie Hall.,HBO Max,False,,0.0
Pan's Labyrinth,2006,"Drama, Fantasy, War",118 min,8.2,,Netflix,True,2024-09-03,0.0
I Am Sam,2001,Drama,132 min,7.7,A mentally handicapped man fights for custody of his 7-year-old daughter and in the process teaches his cold-hearted lawyer the value of love and family.,Amazon Prime,False,,0.0
Les triplettes de Belleville,2003,,80 min,7.8,"When her grandson is kidnapped during the Tour de France, Madame Souza and her beloved pooch Bruno team up with the Belleville Sisters--an aged song-and-dance team from the days of Fred Astaire--to rescue him.",HBO Max,,2017-06-28,
Only the Brave,2017,"Action, Biography, Drama",134 min,7.6,"Based on the true story of the Granite Mountain Hotshots, a group of elite firefighters who risk everything to protect a town from a historic wildfire.",Amazon Prime,False,,10.09
L'avventura,1960,"Drama, Mystery",144 min,7.9,"A woman disappears during a Mediterranean boating trip. During the search, her lover and her best friend become attracted to each other.",Amazon Prime,False,2017-12-11,0.0
Mustang,2015,Drama,97 min,7.6,,Disney+,,,6.02
District 9,2009,"Action, Sci-Fi, Thriller",112 min,7.9,Violence ensues after an extraterrestrial race forced to live in slum-like conditions on Earth finds a kindred spirit in a government agent exposed to their biotechnology.,,False,2018-01-09,0.0
