Series_Title,Released_Year,Genre,Runtime,IMDB_Rating,Overview,Award_Name,Award_Category,Award_Year,Won
Hot Fuzz,2007,"Action, Comedy, Mystery",121 min,,A skilled London police officer is transferred to a small town with a dark secret.,BAFTA,Best Screenplay,2001.0,False
Zerkalo,1975,"Biography, Drama",107 min,8.1,"A dying man in his forties remembers his past. His childhood, his mother, the war, personal moments and things that tell of the recent history of all the Russian nation.",Sundance,Best Screenplay,2002.0,
Zerkalo,1975,"Biography, Drama",107 min,8.1,"A dying man in his forties remembers his past. His childhood, his mother, the war, personal moments and things that tell of the recent history of all the Russian nation.",Golden Globe,Best Screenplay,2021.0,False
Edward Scissorhands,1990,"Drama, Fantasy, Romance",105 min,7.9,"An artificial man, who was incompletely constructed and has scissors for hands, leads a solitary life. Then one day, a suburban lady meets him and introduces him to her world.",Golden Globe,Best Director,2011.0,False
Tonari no Totoro,1988,"Animation, Family, Fantasy",86 min,8.2,"When two girls move to the country to be near their ailing mother, they have adventures with the wondrous forest spirits who live nearby.",Oscar,Best Picture,2015.0,True
The Taking of Pelham One Two Three,1974,"Action, Crime, Thriller",104 min,7.7,"In New York, armed men hijack a subway car and demand a ransom for the passengers. Even if it's paid, how could they get away?",Sundance,Best Director,2022.0,True
Batoru rowaiaru,2000,"Action, Adventure, Drama",114 min,7.6,"In the future, the Japanese government captures a class of ninth-grade students and forces them to kill each other under the revolutionary ""Battle Royale"" act.",Cannes,Best Picture,2003.0,False
Batoru rowaiaru,2000,,114 min,7.6,"In the future, the Japanese government captures a class of ninth-grade students and forces them to kill each other under the revolutionary ""Battle Royale"" act.",Golden Globe,Best Actress,2009.0,True
Batoru rowaiaru,2000,"Action, Adventure, Drama",114 min,7.6,"In the future, the Japanese government captures a class of ninth-grade students and forces them to kill each other under the revolutionary ""Battle Royale"" act.",Oscar,Best Screenplay,2017.0,False
Detachment,2011,Drama,98 min,7.7,A substitute teacher who drifts from classroom to classroom finds a connection to the students and teachers during his latest assignment.,BAFTA,Best Cinematography,2010.0,False
Days of Heaven,1978,"Drama, Romance",94 min,7.8,A hot-tempered farm laborer convinces the woman he loves to marry their rich but dying boss so that they can have a claim to his fortune.,BAFTA,Best Cinematography,2010.0,False
The Thin Man,1934,"Comedy, Crime, Mystery",91 min,8.0,"Former detective Nick Charles and his wealthy wife Nora investigate a murder case, mostly for the fun of it.",Cannes,Best Director,2021.0,False
12 Angry Men,1957,"Crime, Drama",,9.0,A jury holdout attempts to prevent a miscarriage of justice by forcing his colleagues to reconsider the evidence.,BAFTA,Best Actor,2023.0,True
Match Point,2005,"Drama, Romance, Thriller",124 min,,"At a turning point in his life, a former tennis pro falls for an actress who happens to be dating his friend and soon-to-be brother-in-law.",Cannes,Best Actress,2009.0,False
Mission: Impossible - Fallout,2018,"Action, Adventure, Thriller",147 min,7.7,"Ethan Hunt and his IMF team, along with some familiar allies, race against time after a mission gone wrong.",Golden Globe,,2005.0,False
The Breakfast Club,1985,"Comedy, Drama",97 min,7.8,Five high school students meet in Saturday detention and discover how they have a lot more in common than they thought.,BAFTA,Best Director,,True
Back to the Future,1985,"Adventure, Comedy, Sci-Fi",116 min,8.5,"Marty McFly, a 17-year-old high school student, is accidentally sent thirty years into the past in a time-traveling DeLorean invented by his close friend, the eccentric scientist Doc Brown.",Cannes,Best Cinematography,2002.0,
Back to the Future,1985,"Adventure, Comedy, Sci-Fi",116 min,8.5,"Marty McFly, a 17-year-old high school student, is accidentally sent thirty years into the past in a time-traveling DeLorean invented by his close friend, the eccentric scientist Doc Brown.",BAFTA,Best Actor,2019.0,False
It's a Wonderful Life,1946,"Drama, Family, Fantasy",130 min,8.6,An angel is sent from Heaven to help a desperately frustrated businessman by showing him what life would have been like if he had never existed.,Golden Globe,Best Cinematography,2022.0,False
The Little Mermaid,1989,"Animation, Family, Fantasy",83 min,7.6,A mermaid princess makes a Faustian bargain in an attempt to become human and win a prince's love.,Oscar,Best Picture,2012.0,False
Sense and Sensibility,1995,"Drama, Romance",136 min,7.6,"Rich Mr. Dashwood dies, leaving his second wife and her three daughters poor by the rules of inheritance. The two eldest daughters are the title opposites.",Cannes,Best Actor,2005.0,False
Yeopgijeogin geunyeo,2001,"Comedy, Drama, Romance",137 min,8.0,"A young man sees a drunk, cute woman standing too close to the tracks at a metro station in Seoul and pulls her back. She ends up getting him into trouble repeatedly after that, starting on the train.",Sundance,Best Picture,2013.0,True
Bonnie and Clyde,1967,"Action, Biography, Crime",111 min,7.8,"Bored waitress Bonnie Parker falls in love with an ex-con named Clyde Barrow and together they start a violent crime spree through the country, stealing cars and robbing banks.",Oscar,Best Picture,2014.0,True
The Godfather,1972,"Crime, Drama",175 min,9.2,An organized crime dynasty's aging patriarch transfers control of his clandestine empire to his reluctant son.,Golden Globe,Best Picture,2014.0,
The Big Lebowski,1998,"Comedy, Crime, Sport",117 min,8.1,"Jeff ""The Dude"" Lebowski, mistaken for a millionaire of the same name, seeks restitution for his ruined rug and enlists his bowling buddies to help get it.",BAFTA,Best Actress,2009.0,False
Mr. Smith Goes to Washington,1939,"Comedy, Drama",129 min,8.1,,Golden Globe,,2009.0,False
The Treasure of the Sierra Madre,1948,"Adventure, Drama, Western",126 min,8.2,Two Americans searching for work in Mexico convince an old prospector to help them mine for gold in the Sierra Madre Mountains.,BAFTA,Best Actress,,False
Being John Malkovich,1999,"Comedy, Drama, Fantasy",113 min,7.7,A puppeteer discovers a portal that leads literally into the head of movie star John Malkovich.,Cannes,Best Actress,2002.0,False
Being There,1979,"Comedy, Drama",,8.0,,Sundance,Best Screenplay,2011.0,False
Good Will Hunting,1997,"Drama, Romance",126 min,8.3,"Will Hunting, a janitor at M.I.T., has a gift for mathematics, but needs help from a psychologist to find direction in his life.",BAFTA,Best Actor,2015.0,False
Wait Until Dark,1967,Thriller,108 min,7.8,A recently blinded woman is terrorized by a trio of thugs while they search for a heroin-stuffed doll they believe is in her apartment.,BAFTA,Best Cinematography,2016.0,False
Once Upon a Time in America,1984,"Crime, Drama",229 min,8.4,"A former Prohibition-era Jewish gangster returns to the Lower East Side of Manhattan over thirty years later, where he once again must confront the ghosts and regrets of his old life.",Sundance,Best Actress,2018.0,False
Kaze no tani no Naushika,1984,"Animation, Adventure, Fantasy",117 min,8.1,Warrior and pacifist Princess Nausicaä desperately struggles to prevent two warring nations from destroying themselves and their dying planet.,Oscar,Best Actress,2020.0,True
Kaze no tani no Naushika,1984,"Animation, Adventure, Fantasy",117 min,8.1,Warrior and pacifist Princess Nausicaä desperately struggles to prevent two warring nations from destroying themselves and their dying planet.,,Best Cinematography,2014.0,False
Zulu,1964,"Drama, History, War",138 min,7.7,Outnumbered British soldiers do battle with Zulu warriors at Rorke's Drift.,BAFTA,Best Cinematography,2012.0,False
Zulu,1964,"Drama, History, War",138 min,7.7,Outnumbered British soldiers do battle with Zulu warriors at Rorke's Drift.,Golden Globe,Best Actress,2005.0,True
