Series_Title,Released_Year,Genre,Runtime,IMDB_Rating,Overview,Available_On,Subscription_Required,Release_Date,Price
Little Women,2019,"Drama, Romance",135 min,7.8,"Jo March reflects back and forth on her life, telling the beloved story of the March sisters - four young women, each determined to live life on her own terms.",Hulu,False,2021-12-23,0.0
The African Queen,1951,"Adventure, Drama, Romance",105 min,7.7,"In WWI Africa, a gin-swilling riverboat captain is persuaded by a strait-laced missionary to use his boat to attack an enemy warship.",Hulu,,2016-04-17,0.0
Twelve Monkeys,1995,"Mystery, Sci-Fi, Thriller",129 min,8.0,,,False,2020-11-30,0.0
Eskiya,1996,,128 min,8.2,"Baran the Bandit, released from prison after 35 years, searches for vengeance and his lover.",HBO Max,True,2016-09-30,
The Sixth Sense,1999,"Drama, Mystery, Thriller",107 min,8.1,A boy who communicates with spirits seeks the help of a disheartened child psychologist.,Netflix,True,2019-09-20,3.36
Serenity,2005,"Action, Adventure, Sci-Fi",,7.8,The crew of the ship Serenity try to evade an assassin sent to recapture one of their members who is telepathic.,,False,2020-06-24,0.0
Victoria,2015,,138 min,7.6,A young Spanish woman who has recently moved to Berlin finds her flirtation with a local guy turn potentially deadly as their night out with his friends reveals a dangerous secret.,Disney+,False,2024-05-10,0.0
Boyz n the Hood,1991,"Crime, Drama",,7.8,"Follows the lives of three young males living in the Crenshaw ghetto of Los Angeles, dissecting questions of race, relationships, violence, and future prospects.",Hulu,True,2023-02-06,0.0
Mou gaan dou,2002,"Action, Crime, Drama",101 min,8.0,,Netflix,True,,0.0
Kagemusha,1980,,180 min,8.0,A petty thief with an utter resemblance to a samurai warlord is hired as the lord's double. When the warlord later dies the thief is forced to take up arms in his place.,HBO Max,True,2017-01-19,0.0
Apocalypse Now,1979,,147 min,8.4,A U.S. Army officer serving in Vietnam is tasked with assassinating a renegade Special Forces Colonel who sees himself as a god.,,False,2020-10-02,0.0
A Clockwork Orange,1971,"Crime, Drama, Sci-Fi",136 min,8.3,"In the future, a sadistic gang leader is imprisoned and volunteers for a conduct-aversion experiment, but it doesn't go as planned.",Hulu,False,2016-02-24,0.0
Moonrise Kingdom,2012,"Comedy, Drama, Romance",94 min,7.8,"A pair of young lovers flee their New England town, which causes a local search party to fan out to find them.",Disney+,,2017-03-01,
Lost Highway,1997,"Mystery, Thriller",134 min,7.6,,HBO Max,True,2017-03-26,2.41
Knockin' on Heaven's Door,1997,,,8.0,"Two terminally ill patients escape from a hospital, steal a car and rush towards the sea.",Hulu,False,2019-01-16,0.0
Full Metal Jacket,1987,"Drama, War",116 min,8.3,,Netflix,False,2024-06-13,0.0
2001: A Space Odyssey,1968,"Adventure, Sci-Fi",,,"After discovering a mysterious artifact buried beneath the Lunar surface, mankind sets off on a quest to find its origins with help from intelligent supercomputer H.A.L. 9000.",Disney+,,2023-05-11,
Young Frankenstein,1974,Comedy,106 min,8.0,"An American grandson of the infamous scientist, struggling to prove that his grandfather was not as insane as people believe, is invited to Transylvania, where he discovers the process that reanimates a dead body.",,True,2024-07-13,0.0
My Left Foot: The Story of Christy Brown,1989,"Biography, Drama",103 min,7.9,"Christy Brown, born with cerebral palsy, learns to paint and write with his only controllable limb - his left foot.",,,,0.0
The Grapes of Wrath,1940,"Drama, History",129 min,8.0,"A poor Midwest family is forced off their land. They travel to California, suffering the misfortunes of the homeless in the Great Depression.",,False,2018-06-13,0.0
Tenkû no shiro Rapyuta,1986,"Animation, Adventure, Drama",125 min,8.0,A young boy and a girl with a magic crystal must race against pirates and foreign agents in a search for a legendary floating castle.,,,2023-04-07,
Babam ve Oglum,2005,"Drama, Family",112 min,8.3,The family of a left-wing journalist is torn apart after the military coup of Turkey in 1980.,,False,2019-12-19,0.0
Watchmen,2009,,162 min,7.6,"In 1985 where former superheroes exist, the murder of a colleague sends active vigilante Rorschach into his own sprawling investigation, uncovering something that could completely change the course of history as we know it.",Disney+,False,2017-03-07,12.99
Jodaeiye Nader az Simin,2011,,,,A married couple are faced with a difficult decision - to improve the life of their child by moving to another country or to stay in Iran and look after a deteriorating parent who has Alzheimer's disease.,Hulu,True,2020-09-20,0.0
Short Term 12,2013,,96 min,8.0,A 20-something supervising staff member of a residential treatment facility navigates the troubled waters of that world alongside her co-worker and longtime boyfriend.,,True,2017-07-27,
Close Encounters of the Third Kind,1977,"Drama, Sci-Fi",,,,HBO Max,False,2016-10-01,0.0
Inside Man,2006,"Crime, Drama, Mystery",,7.6,"A police detective, a bank robber, and a high-power broker enter high-stakes negotiations after the criminal's brilliant heist spirals into a hostage situation.",Amazon Prime,True,2022-05-29,0.0
"Synecdoche, New York",2008,Drama,124 min,7.6,"A theatre director struggles with his work, and the women in his life, as he creates a life-size replica of New York City inside a warehouse as part of his new play.",Hulu,True,2017-10-25,0.0
Ajeossi,2010,,119 min,7.8,A quiet pawnshop keeper with a violent past takes on a drug-and-organ trafficking ring in hope of saving the child who is his only friend.,HBO Max,,2017-06-13,2.04
About Time,2013,"Comedy, Drama, Fantasy",123 min,7.8,"At the age of 21, Tim discovers he can travel in time and change what happens and has happened in his own life. His decision to make his world a better place by getting a girlfriend turns out not to be as easy as you might think.",,False,2015-05-28,0.0
Män som hatar kvinnor,2009,"Crime, Drama, Mystery",152 min,,A journalist is aided by a young female hacker in his search for the killer of a woman who has been dead for forty years.,Disney+,False,2023-08-29,17.0
Eternal Sunshine of the Spotless Mind,2004,"Drama, Romance, Sci-Fi",108 min,8.3,,,False,2024-02-13,0.0
Forrest Gump,1994,"Drama, Romance",142 min,8.8,,Disney+,False,2017-03-06,11.99
Groundhog Day,1993,,101 min,,A weatherman finds himself inexplicably living the same day over and over again.,,True,2023-02-09,13.92
Manhattan,1979,"Comedy, Drama, Romance",96 min,7.9,The life of a divorced television writer dating a teenage girl is further complicated when he falls in love with his best friend's mistress.,,False,,0.0
The Lion King,1994,"Animation, Adventure, Drama",,8.5,"Lion prince Simba and his father are targeted by his bitter uncle, who wants to ascend the throne himself.",Hulu,True,2022-02-13,
Léon,1994,"Action, Crime, Drama",110 min,8.5,"Mathilda, a 12-year-old girl, is reluctantly taken in by Léon, a professional assassin, after her family is murdered. An unusual relationship forms as she becomes his protégée and learns the assassin's trade.",Amazon Prime,True,2017-05-03,0.0
The Martian,2015,"Adventure, Drama, Sci-Fi",144 min,8.0,"An astronaut becomes stranded on Mars after his team assume him dead, and must rely on his ingenuity to find a way to signal to Earth that he is alive.",HBO Max,True,2017-03-31,0.0
Unforgiven,1992,"Drama, Western",130 min,8.2,"Retired Old West gunslinger William Munny reluctantly takes on one last job, with the help of his old partner Ned Logan and a young man, The ""Schofield Kid.""",HBO Max,True,2022-10-09,6.36
The Fall,2006,"Adventure, Drama, Fantasy",117 min,7.9,,Netflix,False,2022-01-08,
The Invisible Man,1933,"Horror, Sci-Fi",71 min,7.7,"A scientist finds a way of becoming invisible, but in doing so, he becomes murderously insane.",,False,2016-08-16,0.0
La migliore offerta,2013,"Crime, Drama, Mystery",,7.8,A lonely art expert working for a mysterious and reclusive heiress finds not only her art worth examining.,Hulu,False,,0.0
Gake no ue no Ponyo,2008,"Animation, Adventure, Comedy",101 min,,"A five-year-old boy develops a relationship with Ponyo, a young goldfish princess who longs to become a human after falling in love with him.",Disney+,True,2022-03-23,0.0
Bacheha-Ye aseman,1997,"Drama, Family, Sport",89 min,8.3,"After a boy loses his sister's pair of shoes, he goes on a series of adventures in order to find them. When he can't, he tries a new way to ""win"" a new pair.",Amazon Prime,False,2024-08-04,0.0
Planet of the Apes,1968,,,8.0,,Hulu,True,2016-08-25,
Monty Python and the Holy Grail,1975,,91 min,8.2,"King Arthur and his Knights of the Round Table embark on a surreal, low-budget search for the Holy Grail, encountering many, very silly obstacles.",,False,2020-11-26,0.0
Les diaboliques,1955,"Crime, Drama, Horror",117 min,8.0,The wife and mistress of a loathed school principal plan to murder him with what they believe is the perfect alibi.,,True,2019-06-05,0.0
Dog Day Afternoon,1975,"Biography, Crime, Drama",125 min,8.0,,,True,,4.65
Sabrina,1954,"Comedy, Drama, Romance",113 min,7.7,"A playboy becomes interested in the daughter of his family's chauffeur, but it's his more serious brother who would be the better man for her.",Hulu,True,2021-08-20,
Just Mercy,2019,"Biography, Crime, Drama",137 min,,World-renowned civil rights defense attorney Bryan Stevenson works to free a wrongly condemned death row prisoner.,Netflix,False,2016-03-16,
Down by Law,1986,"Comedy, Crime, Drama",107 min,7.8,"Two men are framed and sent to jail, where they meet a murderer who helps them escape and leave the state.",Hulu,False,2022-06-23,15.14
Sholay,1975,"Action, Adventure, Comedy",204 min,8.2,"After his family is murdered by a notorious and ruthless bandit, a former police officer enlists the services of two outlaws to capture the bandit.",HBO Max,False,2016-08-17,0.0
The Nightmare Before Christmas,1993,"Animation, Family, Fantasy",76 min,8.0,"Jack Skellington, king of Halloween Town, discovers Christmas Town, but his attempts to bring Christmas to his home causes confusion.",HBO Max,False,2020-06-04,0.0
La piel que habito,2011,"Drama, Horror, Thriller",120 min,7.6,"A brilliant plastic surgeon, haunted by past tragedies, creates a type of synthetic skin that withstands any kind of damage. His guinea pig: a mysterious and volatile woman who holds the key to his obsession.",Netflix,,2023-03-02,0.0
Billy Elliot,2000,"Drama, Music",110 min,7.7,A talented young boy becomes torn between his unexpected love of dance and the disintegration of his family.,Hulu,False,2015-07-02,
Sleepers,1996,"Crime, Drama, Thriller",147 min,7.6,"After a prank goes disastrously wrong, a group of boys are sent to a detention center where they are brutalized. Thirteen years later, an unexpected random encounter with a former guard gives them a chance for revenge.",Hulu,True,2020-03-24,0.0
The Killing Fields,1984,"Biography, Drama, History",141 min,7.8,"A journalist is trapped in Cambodia during tyrant Pol Pot's bloody 'Year Zero' cleansing campaign, which claimed the lives of two million 'undesirable' civilians.",Disney+,False,2022-01-19,
Magnolia,1999,Drama,188 min,8.0,,Disney+,True,2016-11-17,0.0
Mulan,1998,,88 min,,"To save her father from death in the army, a young maiden secretly goes in his place and becomes one of China's greatest heroines in the process.",,False,2021-03-01,
Skyfall,2012,,,7.7,"James Bond's loyalty to M is tested when her past comes back to haunt her. When MI6 comes under attack, 007 must track down and destroy the threat, no matter how personal the cost.",HBO Max,False,2018-05-11,14.78
La haine,1995,"Crime, Drama",98 min,,24 hours in the lives of three young men in the French suburbs the day after a violent riot.,Netflix,True,2020-01-01,0.0
Amarcord,1973,"Comedy, Drama, Family",123 min,,A series of comedic and nostalgic vignettes set in a 1930s Italian coastal town.,,False,2018-04-05,0.0
Special Chabbis,2013,"Crime, Drama, Thriller",144 min,8.0,A gang of con-men rob prominent rich businessmen and politicians by posing as C.B.I and income tax officers.,HBO Max,False,2018-05-26,0.0
Goodfellas,1990,"Biography, Crime, Drama",146 min,8.7,,Hulu,False,2018-12-07,10.41
Airlift,2016,,130 min,8.0,"When Iraq invades Kuwait in August 1990, a callous Indian businessman becomes the spokesperson for more than 170,000 stranded countrymen.",HBO Max,,2022-12-22,12.95
Papurika,2006,"Animation, Drama, Fantasy",90 min,7.7,"When a machine that allows therapists to enter their patients' dreams is stolen, all Hell breaks loose. Only a young female therapist, Paprika, can stop it.",Disney+,False,2017-02-22,0.0
Prisoners,2013,"Crime, Drama, Mystery",153 min,8.1,"When Keller Dover's daughter and her friend go missing, he takes matters into his own hands as the police pursue multiple leads and the pressure mounts.",,True,2022-06-07,0.0
The Great Escape,1963,"Adventure, Drama, History",172 min,8.2,,Hulu,True,2017-02-02,6.62
The Warriors,1979,"Action, Crime, Thriller",92 min,7.6,,HBO Max,False,2017-03-22,0.0
Cidade de Deus,2002,"Crime, Drama",130 min,8.6,"In the slums of Rio, two kids' paths diverge as one struggles to become a photographer and the other a kingpin.",Amazon Prime,,2020-10-24,0.0
Tropa de Elite,2007,"Action, Crime, Drama",115 min,8.0,"In 1997 Rio de Janeiro, Captain Nascimento has to find a substitute for his position while trying to take down drug dealers and criminals before the Pope visits.",Disney+,,,13.29
Lat sau san taam,1992,"Action, Crime, Thriller",128 min,7.8,A tough-as-nails cop teams up with an undercover agent to shut down a sinister mobster and his crew.,Disney+,False,2021-02-23,0.0
Goldfinger,1964,"Action, Adventure, Thriller",,7.7,"While investigating a gold magnate's smuggling, James Bond uncovers a plot to contaminate the Fort Knox gold reserve.",HBO Max,True,2016-07-13,
Blade Runner 2049,2017,,164 min,8.0,"Young Blade Runner K's discovery of a long-buried secret leads him to track down former Blade Runner Rick Deckard, who's been missing for thirty years.",Hulu,True,2018-10-02,12.16
Per un pugno di dollari,1964,"Action, Drama, Western",99 min,8.0,"A wandering gunfighter plays two rival families against each other in a town torn apart by greed, pride, and revenge.",,False,,
Hiroshima mon amour,1959,"Drama, Romance",,7.9,,Disney+,False,2019-02-09,0.0
Der Name der Rose,1986,"Crime, Drama, Mystery",130 min,7.7,An intellectually nonconformist friar investigates a series of mysterious deaths in an isolated abbey.,,True,2022-01-30,
Room,2015,"Drama, Thriller",118 min,8.1,"Held captive for 7 years in an enclosed space, a woman and her young son finally gain their freedom, allowing the boy to experience the outside world for the first time.",Hulu,True,2022-11-30,0.0
Adams æbler,2005,"Comedy, Crime, Drama",,7.8,A neo-nazi sentenced to community service at a church clashes with the blindly devotional priest.,Amazon Prime,True,2021-07-05,1.4
Inglourious Basterds,2009,"Adventure, Drama, War",153 min,8.3,"In Nazi-occupied France during World War II, a plan to assassinate Nazi leaders by a group of Jewish U.S. soldiers coincides with a theatre owner's vengeful plans for the same.",Netflix,False,2015-09-30,0.0
Miracle on 34th Street,1947,"Comedy, Drama, Family",96 min,7.9,"When a nice old man who claims to be Santa Claus is institutionalized as insane, a young lawyer decides to defend him by arguing in court that he is the real thing.",,True,2017-08-19,0.0
Oldeuboi,2003,"Action, Drama, Mystery",101 min,,"After being kidnapped and imprisoned for fifteen years, Oh Dae-Su is released, only to find that he must find his captor in five days.",,False,2015-06-28,0.0
American Gangster,2007,"Biography, Crime, Drama",157 min,7.8,"An outcast New York City cop is charged with bringing down Harlem drug lord Frank Lucas, whose real life inspired this partly biographical film.",,False,2025-03-29,0.0
Paper Moon,1973,"Comedy, Crime, Drama",102 min,8.1,"During the Great Depression, a con man finds himself saddled with a young girl who may or may not be his daughter, and the two forge an unlikely partnership.",Amazon Prime,True,2022-05-23,0.0
Halloween,1978,"Horror, Thriller",91 min,7.7,"Fifteen years after murdering his sister on Halloween night 1963, Michael Myers escapes from a mental hospital and returns to the small town of Haddonfield, Illinois to kill again.",Hulu,True,2024-05-09,0.0
The Hustler,1961,"Drama, Sport",134 min,8.0,An up-and-coming pool player plays a long-time champion in a single high-stakes match.,Disney+,False,2018-01-07,18.63
Rang De Basanti,2006,"Comedy, Crime, Drama",167 min,8.2,"The story of six young Indians who assist an English woman to film a documentary on the freedom fighters from their past, and the events that lead them to relive the long-forgotten saga of freedom.",Amazon Prime,False,2023-12-07,0.0
Alien,1979,,117 min,,"After a space merchant vessel receives an unknown transmission as a distress call, one of the crew is attacked by a mysterious life form and they soon realize that its life cycle has merely begun.",,False,2018-09-28,0.0
Kingsman: The Secret Service,2014,"Action, Adventure, Comedy",129 min,7.7,"A spy organisation recruits a promising street kid into the agency's training program, while a global threat emerges from a twisted tech genius.",,,,6.23
Roman Holiday,1953,"Comedy, Romance",118 min,8.0,A bored and sheltered princess escapes her guardians and falls in love with an American newsman in Rome.,Disney+,True,2024-06-13,
Tôkyô monogatari,1953,Drama,136 min,,"An old couple visit their children and grandchildren in the city, but receive little attention.",HBO Max,True,2015-11-28,0.0
The Thing,1982,"Horror, Mystery, Sci-Fi",109 min,8.1,A research team in Antarctica is hunted by a shape-shifting alien that assumes the appearance of its victims.,,False,2017-08-10,0.0
Taegukgi hwinalrimyeo,2004,"Action, Drama, War",140 min,,"When two brothers are forced to fight in the Korean War, the elder decides to take the riskiest missions if it will help shield the younger from battle.",,False,2020-11-25,0.0
Låt den rätte komma in,2008,"Crime, Drama, Fantasy",114 min,,"Oskar, an overlooked and bullied boy, finds love and revenge through Eli, a beautiful but peculiar girl.",,True,2020-12-17,0.0
The Apartment,1960,,125 min,8.3,"A man tries to rise in his company by letting its executives use his apartment for trysts, but complications and a romance of his own ensue.",Disney+,False,2018-10-14,0.0
28 Days Later...,2002,"Drama, Horror, Sci-Fi",113 min,7.6,,Hulu,False,2024-10-24,0.0
Nueve reinas,2000,,,7.9,"Two con artists try to swindle a stamp collector by selling him a sheet of counterfeit rare stamps (the ""nine queens"").",,,2025-01-08,1.6
Fried Green Tomatoes,1991,Drama,130 min,7.7,A housewife who is unhappy with her life befriends an old lady in a nursing home and is enthralled by the tales she tells of people she used to know.,,True,2023-02-06,7.96
Vicky Donor,2012,"Comedy, Romance",126 min,7.8,"A man is brought in by an infertility doctor to supply him with his sperm, where he becomes the biggest sperm donor for his clinic.",Netflix,,2020-04-27,0.0
Metropolis,1927,"Drama, Sci-Fi",153 min,8.3,"In a futuristic city sharply divided between the working class and the city planners, the son of the city's mastermind falls in love with a working-class prophet who predicts the coming of a savior to mediate their differences.",Hulu,False,2020-08-29,0.0
Lawrence of Arabia,1962,"Adventure, Biography, Drama",228 min,8.3,"The story of T.E. Lawrence, the English officer who successfully united and led the diverse, often warring, Arab tribes during World War I in order to fight the Turks.",Amazon Prime,False,,0.0
Thor: Ragnarok,2017,"Action, Adventure, Comedy",130 min,,"Imprisoned on the planet Sakaar, Thor must race against time to return to Asgard and stop Ragnarök, the destruction of his world, at the hands of the powerful and ruthless villain Hela.",HBO Max,True,,15.2
The Conversation,1974,"Drama, Mystery, Thriller",113 min,7.8,"A paranoid, secretive surveillance expert has a crisis of conscience when he suspects that the couple he is spying on will be murdered.",Disney+,,2022-08-21,15.86
Dangal,2016,,161 min,8.4,Former wrestler Mahavir Singh Phogat and his two wrestler daughters struggle towards glory at the Commonwealth Games in the face of societal oppression.,Amazon Prime,True,2017-08-27,0.0
Cape Fear,1962,,106 min,7.7,A lawyer's family is stalked by a man he once helped put in jail.,,True,2020-07-05,0.0
Zombieland,2009,,88 min,7.6,"A shy student trying to reach his family in Ohio, a gun-toting tough guy trying to find the last Twinkie, and a pair of sisters trying to get to an amusement park join forces to travel across a zombie-filled America.",Amazon Prime,False,,15.17
Kill Bill: Vol. 2,2004,"Action, Crime, Thriller",137 min,8.0,"The Bride continues her quest of vengeance against her former boss and lover Bill, the reclusive bouncer Budd, and the treacherous, one-eyed Elle.",,True,2023-08-05,11.9
Platoon,1986,"Drama, War",120 min,8.1,"Chris Taylor, a neophyte recruit in Vietnam, finds himself caught in a battle of wills between two sergeants, one good and the other evil. A shrewd examination of the brutality of war and the duality of man in conflict.",,False,2023-04-01,0.0
Hotaru no haka,1988,,89 min,,A young boy and his little sister struggle to survive in Japan during World War II.,,False,2015-06-22,5.14
Darbareye Elly,2009,"Drama, Mystery",119 min,8.0,The mysterious disappearance of a kindergarten teacher during a picnic in the north of Iran is followed by a series of misadventures for her fellow travelers.,Disney+,True,,0.0
Portrait de la jeune fille en feu,2019,,,8.1,"On an isolated island in Brittany at the end of the eighteenth century, a female painter is obliged to paint a wedding portrait of a young woman.",,True,2023-01-20,0.0
The 39 Steps,1935,"Crime, Mystery, Thriller",86 min,,"A man in London tries to help a counter-espionage Agent. But when the Agent is killed, and the man stands accused, he must go on the run to save himself and stop a spy ring which is trying to steal top secret information.",HBO Max,,2022-09-15,0.0
Blue Velvet,1986,"Drama, Mystery, Thriller",120 min,7.7,"The discovery of a severed human ear found in a field leads a young man on an investigation related to a beautiful, mysterious nightclub singer and a group of psychopathic criminals who have kidnapped her child.",Netflix,False,2016-10-29,0.0
The Broken Circle Breakdown,2012,"Drama, Music, Romance",111 min,7.7,"Elise and Didier fall in love at first sight, in spite of their differences. He talks, she listens. He's a romantic atheist, she's a religious realist. When their daughter becomes seriously ill, their love is put on trial.",,,2021-02-14,0.0
In the Name of the Father,1993,"Biography, Crime, Drama",133 min,8.1,,Amazon Prime,True,,0.0
La Strada,1954,Drama,,8.0,"A care-free girl is sold to a traveling entertainer, consequently enduring physical and emotional pain along the way.",Disney+,True,2017-07-08,0.0
Back to the Future Part II,1989,"Adventure, Comedy, Sci-Fi",108 min,7.8,"After visiting 2015, Marty McFly must repeat his visit to 1955 to prevent disastrous changes to 1985...without interfering with his first trip.",HBO Max,False,,0.0
The Bridge on the River Kwai,1957,"Adventure, Drama, War",,8.1,,HBO Max,True,2024-12-02,0.0
Her,2013,"Drama, Romance, Sci-Fi",126 min,,"In a near future, a lonely writer develops an unlikely relationship with an operating system designed to meet his every need.",,False,2024-07-21,0.0
Apollo 13,PG,"Adventure, Drama, History",140 min,7.6,NASA must devise a strategy to return Apollo 13 to Earth safely after the spacecraft undergoes massive internal damage putting the lives of the three astronauts on board in jeopardy.,Amazon Prime,True,2017-06-27,0.0
There Will Be Blood,2007,Drama,158 min,8.2,"A story of family, religion, hatred, oil and madness, focusing on a turn-of-the-century prospector in the early days of the business.",HBO Max,,2023-02-03,9.82
Citizen Kane,1941,"Drama, Mystery",119 min,8.3,"Following the death of publishing tycoon Charles Foster Kane, reporters scramble to uncover the meaning of his final utterance; 'Rosebud'.",,True,2016-11-19,18.8
Good Bye Lenin!,2003,"Comedy, Drama, Romance",121 min,7.7,,Hulu,False,2024-05-01,7.46
Casablanca,1942,"Drama, Romance, War",102 min,8.5,A cynical expatriate American cafe owner struggles to decide whether or not to help his former lover and her fugitive husband escape the Nazis in French Morocco.,Amazon Prime,,2020-11-15,0.0
Nefes: Vatan Sagolsun,2009,"Action, Drama, Thriller",128 min,8.0,Story of 40-man Turkish task force who must defend a relay station.,Disney+,,2021-09-05,0.0
Harry Potter and the Half-Blood Prince,2009,"Action, Adventure, Family",153 min,7.6,"As Harry Potter begins his sixth year at Hogwarts, he discovers an old book marked as ""the property of the Half-Blood Prince"" and begins to learn more about Lord Voldemort's dark past.",,False,2015-12-29,0.0
Paan Singh Tomar,2012,"Action, Biography, Crime",135 min,8.2,,,,2022-10-03,
Hunt for the Wilderpeople,2016,"Adventure, Comedy, Drama",101 min,,A national manhunt is ordered for a rebellious kid and his foster uncle who go missing in the wild New Zealand bush.,Amazon Prime,False,2021-10-06,0.0
Aladdin,1992,"Animation, Adventure, Comedy",90 min,8.0,A kindhearted street urchin and a power-hungry Grand Vizier vie for a magic lamp that has the power to make their deepest wishes come true.,Amazon Prime,False,2025-03-17,7.69
Apocalypto,2006,,139 min,7.8,"As the Mayan kingdom faces its decline, a young man is taken on a perilous journey to a world ruled by fear and oppression.",Netflix,False,2021-07-18,0.0
